{
  "schema_version": "1.0.0",
  "style_id": "futuristic-sci-fi",
  "name": "克制未来科幻",
  "category": "rendering",
  "visual_positioning": "通过结构秩序、材质交界和功能性光线呈现未来感；技术细节应有用途，不能用密集发光线和面板掩盖设计空缺。",
  "use_cases": [
    "未来空间概念",
    "原创载具与道具",
    "科技题材主视觉"
  ],
  "asset_types": [
    "character",
    "prop",
    "vehicle",
    "environment",
    "architecture",
    "product",
    "key_visual",
    "style_reference"
  ],
  "visual_language": {
    "composition": [
      "大尺度结构先于小零件，模块关系清楚；视觉通道和操作区留有空间。"
    ],
    "lighting": [
      "照明随空间和功能走向布置，发光材料只在指定部位出现；光不能穿透不透明实体。"
    ],
    "color": [
      "以稳定基础色配少量功能强调色；资产固定色优先，不自动套用青紫霓虹。"
    ],
    "texture": [
      "金属、涂层、玻璃与复合材料有不同粗糙度和接缝尺度，具体材质必须有资产依据。"
    ],
    "camera": [
      "视点强调尺度和使用关系，避免每个主体都用夸张仰视。"
    ],
    "depth": [
      "通过结构重复、透视与层间遮挡建立深度；薄雾仅在环境允许时使用。"
    ]
  },
  "style_fidelity_anchors": [
    {
      "id": "anchor_1",
      "requirement": "技术外观建立在可解释的结构与功能关系上。",
      "importance": "core"
    },
    {
      "id": "anchor_2",
      "requirement": "光线与材质交界具有一致物理逻辑。",
      "importance": "core"
    },
    {
      "id": "anchor_3",
      "requirement": "大形、连接和识别部件先于装饰性细节。",
      "importance": "core"
    },
    {
      "id": "anchor_4",
      "requirement": "科技成熟度、环境明暗和强调色密度可以调整。",
      "importance": "adaptable"
    }
  ],
  "variables": {
    "technology_mood": {
      "type": "enum",
      "description": "科技氛围，不授权新增功能或零件。",
      "default": "安静可信",
      "choices": [
        "安静可信",
        "探索实验感",
        "宏大秩序感"
      ]
    },
    "light_discipline": {
      "type": "enum",
      "description": "功能光线的组织方式。",
      "default": "低密度引导光",
      "choices": [
        "低密度引导光",
        "自然光主导",
        "少量局部状态光"
      ]
    },
    "detail_density": {
      "type": "enum",
      "description": "允许区域的技术细节量。",
      "default": "疏朗有层级",
      "choices": [
        "疏朗有层级",
        "中等且可解释",
        "近乎无装饰"
      ]
    }
  },
  "prompt_template": "为 {{asset_name}} 采用克制未来科幻表达，科技气氛为 {{technology_mood}}，照明组织采用 {{light_discipline}}，细节密度为 {{detail_density}}。以大尺度结构、可信连接和清楚材质区分建立未来感，不靠无用途装饰。 风格层仅调整视觉表达；主体身份、结构比例、固定颜色与材质、必需标识、用户精确文字及输出规格均服从 AssetSpec，不据风格自行改写。",
  "negative_constraints": [
    "若现有产品结构已锁定，不加通风口、线路、推进器、悬浮结构或发光附件。",
    "若场景不包含界面，不自动生成全息文字、仪表板或无法读取的数字。",
    "若需要展示结构，不用浓雾、强光束或光晕遮盖连接位置。"
  ],
  "source_content_to_avoid": [
    "不从风格样例自动继承人物身份、商品外形、品牌标识、广告文案或水印；资产身份只从已确认 AssetSpec 与绑定身份参考取得。",
    "不继承知名科幻作品的飞船轮廓、制服徽记、建筑造型或界面布局。"
  ],
  "examples": [
    {
      "example_id": "orbital_greenhouse",
      "brief": "轨道温室内部概念场景，分区与通道布局已定义。",
      "asset_type": "environment",
      "variables": {
        "technology_mood": "安静可信",
        "light_discipline": "自然光主导",
        "detail_density": "疏朗有层级"
      },
      "adaptation_notes": [
        "保留种植区与维护通道宽度关系。",
        "未来感来自结构秩序，不增加大量屏幕。"
      ]
    },
    {
      "example_id": "survey_vehicle",
      "brief": "原创无人勘探车的科技主视觉，底盘与传感器数量固定。",
      "asset_type": "vehicle",
      "variables": {
        "technology_mood": "探索实验感",
        "light_discipline": "少量局部状态光",
        "detail_density": "中等且可解释"
      },
      "adaptation_notes": [
        "状态光只能位于已经定义的部件。",
        "不得将轮式结构改成悬浮或增加武器。"
      ]
    }
  ],
  "model_notes": {
    "portability": [
      "未来感是美术方向，不证明工程可行性；需要工程用途时必须另行验证结构与尺寸。",
      "以下均为视觉意图；是否支持负向字段、透明背景、参考图强度或精确尺寸由当前执行能力决定，不能仅因风格名称假定支持。"
    ],
    "parameter_policy": "capability_driven_no_model_lock"
  },
  "selection": {
    "visual_intents": [
      "功能性未来感",
      "结构秩序",
      "可信科技"
    ],
    "natural_language_cues": [
      "克制科幻",
      "未来但能理解怎么用",
      "不要满屏霓虹"
    ],
    "avoid_when": [
      "需原样记录真实现有空间且不能含概念表达。",
      "期待自由添加技术零件而资产又要求结构完全不变。"
    ]
  },
  "authorship": "original_for_image_workbench_v1"
}
