{
  "schema_version": "1.0.0",
  "style_id": "cinematic-realism",
  "name": "叙事电影写实",
  "category": "photography",
  "visual_positioning": "通过有来源的主光、受控暗部与前中后景构成有情绪的真实画面；电影感来自光与空间，不靠堆叠特效或改变主体。",
  "use_cases": [
    "剧情角色定妆",
    "故事场景主视觉",
    "有环境关系的车辆资产"
  ],
  "asset_types": [
    "character",
    "location",
    "environment",
    "vehicle",
    "key_visual",
    "style_reference"
  ],
  "visual_language": {
    "composition": [
      "把叙事重心留给一个明确视觉焦点；以门框、街道边缘或前景遮挡形成方向，主体关键结构保持可读。"
    ],
    "lighting": [
      "主光能解释为窗、灯具或天空；暗部仍有足够细节辨认身份，轮廓光只在合理位置出现。"
    ],
    "color": [
      "环境色可略暖或略冷，用有限色差分离焦点；不把统一色调强加到资产固定色上。"
    ],
    "texture": [
      "皮肤、织物、漆面保留自然微纹理，适量细颗粒不遮蔽结构。"
    ],
    "camera": [
      "根据叙事距离选择中景、近景或环境全景；透视与相机高度保持一致。"
    ],
    "depth": [
      "前景轻遮挡、中景主体、后景信息分层；景深不能抹去验收所需部件。"
    ]
  },
  "style_fidelity_anchors": [
    {
      "id": "anchor_1",
      "requirement": "主光方向与可见环境逻辑一致。",
      "importance": "core"
    },
    {
      "id": "anchor_2",
      "requirement": "主体在高光和暗部均保留可信结构与材质。",
      "importance": "core"
    },
    {
      "id": "anchor_3",
      "requirement": "场景层次服务一个叙事重心，不用多个亮点争夺注意。",
      "importance": "core"
    },
    {
      "id": "anchor_4",
      "requirement": "冷暖关系、遮挡比例与景深可按场景功能调整。",
      "importance": "adaptable"
    }
  ],
  "variables": {
    "light_motivation": {
      "type": "string",
      "description": "主光的合理来源与方向，不添加未要求的道具。",
      "default": "侧窗漫射光"
    },
    "tonal_mood": {
      "type": "enum",
      "description": "环境的明暗情绪，不改变固定物体色。",
      "default": "克制中性",
      "choices": [
        "克制中性",
        "温暖安静",
        "冷静紧张"
      ]
    },
    "depth_strategy": {
      "type": "enum",
      "description": "主体与环境的层次方式。",
      "default": "前中后三层",
      "choices": [
        "前中后三层",
        "主体清晰环境轻虚",
        "环境与主体共同清晰"
      ]
    }
  },
  "prompt_template": "为 {{asset_name}} 采用叙事电影写实表达：以 {{light_motivation}} 建立可信照明，环境情绪为 {{tonal_mood}}，空间按 {{depth_strategy}} 组织。让视线集中在场景中的既定主体与动作，保持材质微纹理及可读暗部。 风格层仅调整视觉表达；主体身份、结构比例、固定颜色与材质、必需标识、用户精确文字及输出规格均服从 AssetSpec，不据风格自行改写。",
  "negative_constraints": [
    "若需识别脸部或产品细节，不允许阴影把关键特征完全吞没。",
    "若 AssetSpec 要求静态展示，不添加爆炸、雨雾、追逐或动作模糊。",
    "若场景没有对应光源，不出现无来源的彩色轮廓光。"
  ],
  "source_content_to_avoid": [
    "不从风格样例自动继承人物身份、商品外形、品牌标识、广告文案或水印；资产身份只从已确认 AssetSpec 与绑定身份参考取得。",
    "不要沿用某一影片的标志性镜位、演员面容、剧照布景与情节组合。"
  ],
  "examples": [
    {
      "example_id": "station_portrait",
      "brief": "车站值班员的半身角色资产，面容与制服已锁定。",
      "asset_type": "character",
      "variables": {
        "light_motivation": "候车厅上方柔光与远侧窗光",
        "tonal_mood": "温暖安静",
        "depth_strategy": "主体清晰环境轻虚"
      },
      "adaptation_notes": [
        "保留身份参考中的面部比例与制服颜色。",
        "背景只交代车站空间，不增加可辨认路人。"
      ]
    },
    {
      "example_id": "night_bus",
      "brief": "夜间停靠的电动公交车场景，车辆轮廓和涂装固定。",
      "asset_type": "vehicle",
      "variables": {
        "light_motivation": "站台顶灯从车身一侧照下",
        "tonal_mood": "冷静紧张",
        "depth_strategy": "前中后三层"
      },
      "adaptation_notes": [
        "车身结构与涂装不得随电影调色改变。",
        "用路面与站台关系制造空间，不虚构车灯结构。"
      ]
    }
  ],
  "model_notes": {
    "portability": [
      "电影感以光线方向、层次和明暗描述表达，不绑定电影镜头型号或厂商色彩预设。",
      "以下均为视觉意图；是否支持负向字段、透明背景、参考图强度或精确尺寸由当前执行能力决定，不能仅因风格名称假定支持。"
    ],
    "parameter_policy": "capability_driven_no_model_lock"
  },
  "selection": {
    "visual_intents": [
      "可信叙事",
      "情绪化光线",
      "空间层次"
    ],
    "natural_language_cues": [
      "像电影里的一个安静镜头",
      "写实但有剧情感",
      "有来源的灯光和深色背景"
    ],
    "avoid_when": [
      "需要无阴影的测量图或严格正交图。",
      "必须完全平面化或逐像素一致。"
    ]
  },
  "authorship": "original_for_image_workbench_v1"
}
